file_name,QuestionText,answer
"Cat purring quietly.wav","Which part of the hand is strumming on the surface top?",FINGERS
"Montage Maschiene 03.wav","How many copies did the copy machine print?",ELEVEN
"Remote highway atmosphere.wav","What animal is making noise?",BIRD
"Remote highway atmosphere.wav","What can be heard in the background constantly?",CHIRPING
"wind_in_long_reeds_24_96_mono.wav","What is the weather like?",RAINY
"Hwy84Westbound2A.wav","How many vehicles are heard passing through the tunnel ?",SEVEN
"20100802.sawing.wav","What is being cut?",WOOD
"20100802.sawing.wav","What is the name of the tool being used?",SAW
"Living Room Room Tone.wav","If someone interacted with this substance, how would they end up?",WET
"Clock.Windup.Bell.Antique.wav","How many times is something wound up?",TWO
"TrashCompactor.wav","How many times does the machine open the steam cap to let out steam ?",ONE
"TrashCompactor.wav","What kind of sound interrupts the buzzing sound around the middle?",BANG
"Scottish Beach near Dunbar.wav","What is crashing against the sand?",WAVES
"Footsteps Dirt 01.wav","What is this person walking on?",GRAVEL
"Footsteps Dirt 01.wav","When the sound speeds up, what is the person doing?",RUNNING
"rain_near_city_far.wav","What else is heard with the rain?",TRAFFIC
"rain_near_city_far.wav","What is falling from the sky?",RAIN
"Small Creek.wav","What is the liquid that is being heard?",WATER
"Small Creek.wav","Where is the liquid landing?",WATER
"Thunder_birds_rain.wav","How is the weather?",RAINY
"Thunder_birds_rain.wav","What wheeled vehicle is heard at the end of the clip?",TRUCK
"down stairs running 1.wav","What body part is making most of the sounds?",FEET
"INT Bedroom tone 1.wav","How many times does a horn blow?",ZERO
"Coffee Machine Trickling.wav","What appliance makes this sound?",REFRIGERATOR
"Coffee Machine Trickling.wav","What element is flowing into the container?",WATER
"30 seconds after (Mike Marsh).wav","how many beeps are heard?",THREE
"30 seconds after (Mike Marsh).wav","Who gasps before the police sirens?",WOMAN
"White River birds 2.wav","What covers the body of the animal making these sounds?",FEATHERS
"waves beach medium1 close.wav","At what sandy place is this commonly heard?",BEACH
"VNP_thurston_02.wav","How many showers or faucets are on?",ONE
"VNP_thurston_02.wav","What animal is chirping?",BIRD
"Centurion Suburb Night.wav","What can be heard pouring down?",RAIN
"granny glissando.wav","How many aircrafts did take off ?",ONE
"Rain falling sound.wav","what is falling from sky?",RAIN
"Rain falling sound.wav","Where is this sound located?",OUTSIDE
"Door.wav","How many thumps can be heard?",TWO
"Door.wav","What is the object?",DOOR
"Backhoe.wav","How many vehicles are being operated?",ONE
"Backhoe.wav","What material is being cut ?",WOOD
"Light Rain Home2.wav","What is dripping?",WATER
"grifo goteando.wav","How many voices are heard at the end of the sample?",ONE
"ResidentialFallNight_crickets.wav","How many types of bugs are making noise?",TWO
"Tree Rustle 4.wav","What animal is chirping in the background?",BIRD
"Tree Rustle 4.wav","What kind of precipitation can be heard?",RAIN
"Radio Fuzz for Old Radio Broadcast FF233.wav","What kind of constant noise is coming from the radio?",STATIC
"Radio Fuzz for Old Radio Broadcast FF233.wav","What sound is the radio making?",STATIC
"PageFlip5.wav","What type of object is being handled?",BOOK
"wood_saw_01.wav","how many people can be heard talking?",NONE
"wood_saw_01.wav","What tool is someone using?",SANDER
"dishes rattle.wav","how many times is there shaking?",FIVE
"Nord_Odal_Nyhus_04_juni_2011_quiet_forest_birds_insects_distant_chainsaw_01.wav","What speed is the vehicle moving?",FAST
"Nord_Odal_Nyhus_04_juni_2011_quiet_forest_birds_insects_distant_chainsaw_01.wav","What type of animal was making sounds?",BIRD
"Natural Ambience 01.wav","What is making the chirping noise outside?",BIRDS
"Natural Ambience 01.wav","Where are the birds?",TREES
"water_flows_through_crack_in_rocks.wav","What element is being recorded?",WATER
"Dog Barking .wav","How many times does the dog bark?",SIXTEEN
"old tractor passing Hatz.wav","What animal could be running at the end?",COW
"old tractor passing Hatz.wav","what is the car doing at the end?",DRIVING
"Water drops.wav","What direction is the water coming from?",UP
"Water drops.wav","What is the water doing?",DRIPPING
"Wind in a field recorded close to the ground in New Mexico, USA.wav","What is the sound that swishes?",WIND
"Wind in a field recorded close to the ground in New Mexico, USA.wav","what is the wind doing?",BLOWING
"STE-014-lisbonfountain01.wav","In what direction is the water moving?",DOWN
"STE-014-lisbonfountain01.wav","What is being run?",WATER
"OsFnHhVsDoors.wav","What is being opened and closed repetitively?",DOOR
"Ambience Urban park fountain early evening.wav","What gender is the person speaking?",FEMALE
"Ambience Urban park fountain early evening.wav","What is the person doing?",TALKING
"CONSTRUCTION SAW.wav","How is this machine powered?",ELECTRICITY
"CONSTRUCTION SAW.wav","Wat material is being cut?",WOOD
"hort.wav","How many different voices are there?",ONE
"Les_Feuilles_Mortes141020.wav","what is the background noise doing?",RAIN
"Heavy Rain in the suburbs.wav","What is the booming sound near the end of the clip?",THUNDER
"Rope tied to boat in port.wav","What is the man opening?",DOOR
"Rope tied to boat in port.wav","What is the person doing with the door?",OPENING
"Sea sound-3.wav","What kind of water is causing the noise?",WAVES
"Sea sound-3.wav","where are the waves coming from?",OCEAN
"shaking and opening a water bottle.wav","How is the weather here?",RAINING
"robin_3.wav","What are the birds doing?",CHIRPING
"robin_3.wav","What is making the chirping noise?",BIRDS
"Relaxing stream underwater SHORT 141015_0442.wav","What is there a steady flow of?",WATER
"Lekkers Ambience.wav","A female is talking to a person of what gender?",MALE
"Lekkers Ambience.wav","What are the humans doing?",TALKING
"bowling_basin_2.wav","What sound is heard in the recording?",TRAFFIC
"bm_lampshade.wav","How many times does the instrument gong?",SIX
"04-Bakken_GamblingMachines_Hall.wav","How many kids are heard screaming?",TWO
"04-Bakken_GamblingMachines_Hall.wav","How many people can be heard laughing?",ONE
"Pensol - le Moulin cours d&#39;eau.wav","What type of element can be heard in the recording?",WATER
"Schnelllauferpresse 01.wav","how many times is the pound heard?",FIFTY
"London Underground- tube train at station.wav","In what stage of life is the main human speaker?",ADULT
"London Underground- tube train at station.wav","What gender is the recorded voice?",FEMALE
"sw_PoultryBarn_cs8049.wav","What kind of animals are around?",BIRDS
"Bottle Open Pour Fizz.wav","how many times does something get poured?",ONCE
"Bottle Open Pour Fizz.wav","What human sensation would cause someone to conduct this activity?",SOUND
"Nordschleife_Vorkriegsrennwagen_1.wav","What is making the sound?",MOTORCYCLE
"41_STEAM.wav","What is being sprayed?",WATER
"Car passing.wav","What are the objects on the car that touches the road to create sound?",TIRES
"Echo Garage Door.wav","how many times does the noise repeat?",THREE
"Footsteps_Squeeky_Wood.wav","What are the steps made of?",WOOD
"20090105.crowd.drums.wav","How many times does the entire crowd exclaim the same chant in unison?",ONE
"Dog whining.wav","What is the animal doing?",BARKING
"Dog whining.wav","Which animal is making the noise?",DOG
"Cruiseship - inside, crew cabin at night.wav","How many times is the tapping noise heard ?",THREE
"20091224.bells.02.wav","What are ringing?",BELLS
"Ocean breeze - wind howling.wav","How many people are breathing?",ONE
"Metal spoon on china plate.wav","How many objects are being held?",TWO
"Fuente_collserola_bcn.wav","What is making the sound?",WATER
"Fuente_collserola_bcn.wav","what is the water doing?",RUNNING
"ambient 2.wav","What art form is this?",MUSIC
"ambient 2.wav","Which tone is heard first?",PIANO
"vent_int_garage2.wav","What happens between the initial thud and the first clinking sound?",NOTHING
"Outdoors rumble.wav","What color noise is this?",WHITE
"promenade_Lanzarote_kids_people_talking_bicycles_AMB_EXT.wav","What living creature is making sound?",HUMAN
"_Stream 4 at Krka falls.wav","What's making that sound?",RAIN
"Burleson01.wav","What animal was heard in the background?",COW
"Burleson01.wav","What body movement can be heard?",WALKING
"Crow noise.wav","how many times does the bird squawk?",SIXTEEN
"SwampFrogsAndGeese.wav","what are talking?",BIRDS
"SwampFrogsAndGeese.wav","what is making the repetitive sound?",BIRDS
"Remix of 101980__pyr0x__growl_variants.wav","How many times is there breathing or snoring?",SIX
"Slider door.wav","What is being opened?",DOOR
"Slider door.wav","What type of mammal is completing the task?",HUMAN
"Kobe-train-announcement-and-arrival.wav","what is the machine which can be heard stopping?",TRAIN
"Water Streaming #5.wav","What direction is the water moving from the faucet?",DOWN
"Water Streaming #5.wav","What is the water doing?",FALLING
"Outside01.wav","How many human voices are there?",ONE
"Giant 1.wav","What is the person doing?",TALKING
"cars_pass_01_070812.wav","How many cars can be heard?",TWO
"cars_pass_01_070812.wav","What is the person standing next to to get this sound?",ROAD
"city pouring rain.wav","What is happening?",RAINING
"city pouring rain.wav","What is the weather?",RAINING
"squeeks raw.wav","What is the swing made out of?",METAL
"Train Station Loudspeakers.wav","How many separate voices can be heard?",TWO
"Sound_Of_Sea_In_Harbour.wav","What kind of animal is present?",DOG
"conversation.wav","What are the people doing?",TALKING
"River Alde marsh.wav","What kind of animals are there?",BIRDS
"SpaceAmbient.wav","What does it sound like?",STORM
"SpaceAmbient.wav","What is the color of this sound?",WHITE
"Seashore Atmos LW2.wav","How many vehicles are heard?",TWO
"Seashore Atmos LW2.wav","What type of vehicle is heard?",MOTORCYCLE
"bistro, ambient noise, talking.wav","How many people can be heard?",FOUR
"bistro, ambient noise, talking.wav","what gender of people are talking?",FEMALE
"Kids chatter Primary School Birmingham UK.wav","What kind of place is this?",SCHOOL
"Paper shredder.wav","What is being scrunched up in the device over and over again?",PAPER
"Paper shredder.wav","What is crunching?",PAPER
"20140809_cruzul.river.wav","This substance is used by humans for what recreational activity?",SWIMMING
"20140809_cruzul.river.wav","What element is flowing?",WATER
"T12_Huber_Walking on Gravel.wav","What is the person doing?",WALKING
"SummerSwellingInsectsFerneCliff.wav","What green thing does this device usually water?",GRASS
"TOWN_CAR_START.wav","How many people are talking?",ONE
"TOWN_CAR_START.wav","How many vehicles can be heard?",ONE
"Soft rain in Berlin with thunder in background.wav","How is the weather?",RAINY
"20120715_ourense.bell.01.wav","What else can be heard in the background?",TALKING
"20120715_ourense.bell.01.wav","What is ringing?",BELL
"FP_Flock_of_Birds.wav","How many objects are making noise?",ONE
"FP_Flock_of_Birds.wav","What gender is the person who applied the distortion to this sound clip?",UNKNOWN
"Uh, Hi, Mom. I Crashed the Car.wav","What gender is the speaker?",MALE
"Uh, Hi, Mom. I Crashed the Car.wav","What is the man doing?",TALKING
"Park Szczubeka Ulica Powsinska.wav","What animal is heard?",BIRD
"Lake At Night.wav","What insect is chirping?",CRICKET
"Cornell Big Cheer.wav","What kind of sounds are the people making?",CHEERING
"Seagulls 1.wav","How many birds are making noise?",TWO
"Seagulls 1.wav","What are the birds doing?",CHIRPING
"elevator sequence ambience door opens closes descends door opens.wav","What creaks open?",DOOR
"elevator sequence ambience door opens closes descends door opens.wav","What is making the clicking noise?",DOOR
"Walking on snow frozen to ice.wav","What is the person doing?",WALKING
"Collingwood bees, bumble bees.wav","What animal species is making the non-buzzing sound?",BIRD
"Feria.wav","At what point does music play?",BEGINNING
"Feria.wav","What is the small animal heard for a split second in the background?",BIRD
"Deltic Diesel Train Departure~Irwell Vale Halt~Bury.wav","How many times does the whistle blow?",ONCE
"Deltic Diesel Train Departure~Irwell Vale Halt~Bury.wav","What type of vehicle is it?",TRAIN
"am band static.wav","What is having its channels being changed?",RADIO
"Bonnet Macaque Alarm Call @ GoaMarch 9 2013.wav","How many times the the animal make its loud sound?",EIGHT
"Bonnet Macaque Alarm Call @ GoaMarch 9 2013.wav","What kind of animal is calling out?",DUCK
"Train_LightRail_By_T0147.wav","What is passing by?",TRAIN
"Street Seller in Mexico City. Tights for girls.wav","How many voices are there?",ONE
"Street Seller in Mexico City. Tights for girls.wav","What is the gender of the speaker?",MALE
"Door opening_closing.wav","How many times is the door slammed?",FOUR
"Fly_versus_Lamp.wav","what is the fly doing?",FLYING
"rim of woods farmland people far NL 01 151003_0804 ST.wav","how many birds can be heard?",THREE
"rim of woods farmland people far NL 01 151003_0804 ST.wav","What is the bird doing?",CHIRPING
"md1trk38.wav","What kind of creature would operate this device?",HUMAN
"el sonido del arbol y la tierra yerlin .wav","How many different voices are there?",FIVE
"Ravens.wav","What is the four letter name of these common black birds?",CROW
"161006_0075 creaking floor -nr.wav","What kind of creature is making the sound?",WOOD
"TrainAmbience(Mix).wav","How many different voices are heard?",THREE
"TrainAmbience(Mix).wav","What living creatures are making sounds?",HUMANS
"20061022.upstairs.wav","What is the person holding?",KEYS
"20061022.upstairs.wav","What is used to open the door?",KEY
"20060426.marsh.house.ambiance.wav","What is chirping?",BIRDS
"ocean_cape.wav","How many times do the waves crash?",THREE
"ocean_cape.wav","How waves are there?",TWO
"Boom_Folie_PlayingWithCurtains.wav","What type of material might be making the high pitched scraping sound?",METAL
"01-31 Footsteps, Wood, Barefoot, Jumps &amp; Scuffs.wav","How many objects were dropped?",THREE
"01-31 Footsteps, Wood, Barefoot, Jumps &amp; Scuffs.wav","When does the thumping take place?",BEGINNING
"OldCarHornsAndSirens.wav","How many honks can be heard?",TWO
"OldCarHornsAndSirens.wav","The vehicles are en route to what type of event, in general?",EMERGENCY
"Shaking and dragging of jar with stones.wav","What is this object?",BAG
"Tires car without an engine.wav","What are the people doing?",DRIVING
"Tires car without an engine.wav","What terrain is the vehicle driving through?",WET
"woodpecker, wind and dogs.wav","What animal is heard?",BIRD
"woodpecker, wind and dogs.wav","What are the birds doing?",CHIRPING
"Stepping in puddles w ambient rain.wav","What is more quietly heard in the background?",RAIN
"Gravel_Sand Walking 2.wav","How many steps does the person make?",TWENTY
"Chopping parsley.wav","What is being used to cut the objects?",KNIFE
"static 770 kHz cycle zap.wav","What is interrupting the sound going on?",STATIC
"under flyover_300513.wav","How many birds are going back and forth with each other?",TWO
"Stream 1 at Krka falls.wav","What is the weather like?",RAINY
"Stream 1 at Krka falls.wav","What sort of sound is it?",RAIN
"Lake Wars_extract.wav","What is making the laser sound?",SPILLING
"seagulls.wav","What animals are making noise?",BIRDS
"Wind, Soft. Crickets.wav","How calm is this?",VERY
"Wind, Soft. Crickets.wav","What kind of frequency is the noise?",HIGH
"2 08 Br Lib 2 amb kids.wav","How may different people are heard talking ?",THREE
"BANISTER_FLOOR CREAK.wav","Where was the man speaking?",OFFICE
"Water - Stones.wav","what are the waves doing?",CRASHING
"Water - Stones.wav","What is moving?",WATER
"cow bells.wav","What is blowing in the wind?",CHIMES
"cow bells.wav","What is the weather like?",WINDY
"Radio Static 1 (wav).wav","What is the volume of the machine?",LOUD
"Coffee Maker Brewing.wav","What is being made?",COFFEE
"junction_night_traffic.wav","What is humming?",CAR
"junction_night_traffic.wav","What is the vehicle doing as the humming gets farther in distance?",ACCELERATING
"Train leaving the station.wav","What is the object that created a sharp, piercing sound?",WHISTLE
"Birds_and_Water_Filling_Rain_Barrel.wav","Which one of the 4 elements is it?",WATER
"file0699_4_birdsong.wav","what is the bird doing?",CHIRPING
"file0699_4_birdsong.wav","What kind of animal is making the sound?",BIRD
"Kitchen Clock Ticking 2.wav","how many times does the clock tick?",NINETEEN
"Kitchen Clock Ticking 2.wav","What is ticking?",CLOCK
"River far 1.wav","What animal is heard in the background?",BIRD
"River far 1.wav","What can be heard throughout the clip?",WATER
"Thunder - Guangzhou - China - Quiet.wav","How many times does it thunder?",TWO
"Thunder - Guangzhou - China - Quiet.wav","What condition would someone be in if there were caught outside?",WET
"dish washing, distance, ambience .wav","What is the liquid heard in the background?",WATER
"People walking through forest.wav","What are the people doing?",WALKING
"People walking through forest.wav","What object is being crunched?",LEAVES
"Atmo Wartehalle2.wav","How many hand claps are there?",THREE
"Rain Aluminium Roof.wav","What is on fire?",WOOD
"Rain Aluminium Roof.wav","What metal object is the rain hitting?",ROOF
"Burco Conveyer Toaster running.wav","what is making the screeching noise?",MACHINE
"Burco Conveyer Toaster running.wav","What is the machine doing?",WHIRRING
"Motorcycle 1.wav","What type of vehicle engine is this ?",DIESEL
"propplaneflyover.wav","How fast does the engine move?",FAST
"Pas sur le sol.wav","What is making sound?",SHOES
"Bear Last Audio.wav","This kind of a noise from an animal would be considered a what?",GROWL
"Bear Last Audio.wav","What kind of creature is making the sounds?",DOG
"TRAN_Plane_PropSpin_01.wav","What is making the sound?",AIRPLANE
"TRAN_Plane_PropSpin_01.wav","What sound is the plane making?",WHIRRING
"Shower and walk - front.wav","How many times is there another distinct sound, that is NOT the rain?",TWO
"Shower and walk - front.wav","What type of weather condition is occurring?",RAIN
"Footsteps Walking in Forest tractor in background-1.wav","What animal makes a noise?",BIRD
"Footsteps Walking in Forest tractor in background-1.wav","What are they walking on?",SNOW
"Crowd in a local market.wav","What sound can be heard at the end?",TALKING
"Crowd in a local market.wav","who, other than adults, are talking?",CHILDREN
"cat hiss yowl.wav","What does the baby do the whole time?",CRYING
"cat hiss yowl.wav","what kind of animal is that?",CAT
"SamyeLing_Pheasant121102.wav","How many barks are there?",SIX
"SamyeLing_Pheasant121102.wav","How many legs does this animal have?",FOUR
"Spring Rain 1.wav","what is the rain doing?",DRIPPING
"Spring Rain 1.wav","What liquid is flowing ?",WATER
"wooden boat row water.wav","What is being used to move the water around?",PIPE
"Untitled-13.wav","What genre of movie could this be used in?",HORROR
"Ferry I.wav","What type of weather could it be?",WINDY
"train accelerating on trestle.wav","How many times does the machine accelerate?",TWICE
"20061224.car.starting.wav","How many clicking sounds before the vehicle starts?",TWO
"20061224.car.starting.wav","What is the person doing with the vehicle?",DRIVING
"Rain at the city window - 44.1kHz16Bit - XYStereo - TASCAM - DR40 - intMic - normalized - fade in and fade out.wav","How is the weather?",RAINING
"Rain at the city window - 44.1kHz16Bit - XYStereo - TASCAM - DR40 - intMic - normalized - fade in and fade out.wav","How many cars pass by on the wet road?",ONE
"book_light_noise.wav","What kind of book is being flipped through?",PAPER
"contact_floor_lamp.wav","What kind of hammer is being used?",JACKHAMMER
"contact_floor_lamp.wav","What kind of material is being hit?",METAL
"SparklingSound.wav","What can be heard rumbling in the background?",THUNDER
"SparklingSound.wav","What is heard in the background?",WIND
"elicottero.wav","What is flying?",HELICOPTER
"waves.wav","What is flowing?",WATER
"Int. Car Drive 1.wav","What is the weather like?",WINDY
"Stairwell with echo Front.wav","How many steps does the person take?",TWENTYSIX
"Stairwell with echo Front.wav","What is the person doing?",WALKING
"DR-100_0016_CPH train station_01.wav","What are the people in the area doing?",TALKING
"DR-100_0016_CPH train station_01.wav","What is crying in the background?",BABY
"Rain drops.wav","What are the children doing?",TYPING
"bm_drip.wav","What is the element here called when It's frozen?",ICE
"tadpolesound.wav","What is falling?",WATER
"tadpolesound.wav","what is the water doing?",RUNNING
"Elevator sounds.wav","How many beeps occur?",TWO
"CoinSpin.wav","What is making noise?",COINS
"Rain after Thunder from Shed 2013-07-25 2.wav","what is falling from the sky?",RAIN
"birds_in_moms_garden.wav","what animal makes a noise other than the birds?",COW
"birds_in_moms_garden.wav","What is chirping?",BIRDS
"Cable rustling 1-01.R.wav","How many people are heard?",TWO
"immersion in a bath and getting out of the bath.wav","How many times is the water splashed?",TWO
"20061214.wrench.02.wav","What is the part that is making the high pitched dinging most likely made out of?",METAL
"ClockTicking.wav","How many times does the sound repeat?",THIRTY
"ClockTicking.wav","What is the consistency of the object that produces the sound?",METAL
"helicopter.L.wav","what is the helicopter doing?",FLYING
"helicopter.L.wav","Who is operating this vehicle?",PILOT
"Summer Ambiance .wav","What animal is making noise?",BIRD
"Summer Ambiance .wav","what is the bird doing?",SINGING
"Door creaking.wav","How many objects are making this creaking noise?",ONE
"Door creaking.wav","What object is making this creaking sound?",DOOR
"Hand Basin Water.wav","Where does the water come from?",TAP
"Rain after Thunder from Shed 2013-07-25 1.wav","what is the rain hitting?",GROUND
"Rain after Thunder from Shed 2013-07-25 1.wav","What type of weather can be heard?",RAIN
"Shower Driping Fast to Slow.wav","What happens to the sound at the end?",STOPS
"Shower Driping Fast to Slow.wav","What is the overall speed of the sound?",FAST
"Ambience - Merri path, trees and birds, gentle wind.wav","What are the birds doing?",CHIRPING
"Ambience - Merri path, trees and birds, gentle wind.wav","What type of animal can be heard?",BIRDS
"bird-twitter-car.wav","How many times does a vehicle pass by ?",ONCE
"bird-twitter-car.wav","What kind of animal is chirping in the background?",BIRD
"00214 supermarket entrance 1.wav","What animal can be heard?",DOG
"CRAZY.BIRDS.VERY.ACTIVE.WYOMMING.wav","What is making all the noise?",BIRDS
"CRAZY.BIRDS.VERY.ACTIVE.WYOMMING.wav","What kind of animals are making noise?",BIRDS
"Sink_Running_Water.wav","What object is making this noise?",FAN
"Sink_Running_Water.wav","Where does this take place?",BATHROOM
"Triumph start and idle.wav","What is the motor doing?",START
"Exterior Prius In Stop Away series w door open and beeps at head.wav","What was being closed?",DOOR
"circulation.wav","What is the noise?",SIREN
"ruffle.wav","How many people are producing sound?",ONE
"ruffle.wav","What is the man flipping through?",PAPER
"Noisy Hotel Bathroom Fan (starts + stops).wav","What device is turning in this sound clip?",FAN
"Noisy Hotel Bathroom Fan (starts + stops).wav","What is the object being turned on and off?",FAN
"Quiet Mood.wav","What sound is heard at the end?",PIANO
"lungs.wav","How many clicks are there?",ONE
"lungs.wav","How many sounds can be heard?",TWO
"tennis ball.wav","how many tap sounds are there?",FIFTEEN
"tennis ball.wav","What type of ball is being struck?",TENNIS
"Small quiet street ambience.wav","Which animal is making a sound?",BIRD
"crossing the river.wav","How many people are apparently walking?",ONE
"crossing the river.wav","How many steps does the person take?",FORTY
"OrchestraTuning1.wav","What do people do at the end of the recording?",CLAP
"OrchestraTuning1.wav","What is the name of the group that is doing the clapping?",AUDIENCE
"Oven Door.wav","What is slammed?",GATE
"outdoors ambient windy wind leaves rustle near airport plane hum.wav","How does the ground likely feel?",WET
"outdoors ambient windy wind leaves rustle near airport plane hum.wav","How is the weather here?",RAINY
"05 hn_PittsPennLincoln.wav","How many vehicles can be heard?",TWO
"05 hn_PittsPennLincoln.wav","What type of vehicle is making the revving noise?",CAR
"walking trough wetlands.wav","What is the person doing?",WALKING
"01058 main street walk.wav","What is the person walking doing throughout the audio?",TALKING
"Stream Honiton.wav","What is singing?",BIRDS
"Walking along Highway.wav","How many steps did the person walking take?",FORTY
"Walking along Highway.wav","How many vehicles drive down the road?",THREE
"PAPER_PULLED_FROM_PURSE.wav","The person making requests is probably the what?",PERSON
"PAPER_PULLED_FROM_PURSE.wav","what gender of person is closest to the microphone and talking?",FEMALE
"Car Driving.wav","What surface is the vehicle traveling on?",PAVEMENT
"sink3.wav","How many coffee mugs is this person washing ?",ONE
"sink3.wav","what turns off at the end?",FAUCET
"FootstepsUpstairs.wav","How many times did the footsteps come to a complete stop for more than a couple of seconds?",ONE
"FootstepsUpstairs.wav","What made the creaking noise?",FLOORBOARD
"Swifts.wav","What type of animal is making noise at the beginning ?",BIRD
"shopping-cart-rattle.wav","How does the animal respond?",BARKING
"shopping-cart-rattle.wav","How many times does the dog bark?",TWO
"130915 - Interior-Hard Rain with 2 Skylights.wav","What is falling onto the surface to make that noise?",RAIN
"130915 - Interior-Hard Rain with 2 Skylights.wav","What sort of weather can be heard?",RAIN
