file_name,QuestionText,answer
"birds_stereo.wav","How many different birds can be heard?",TWO
"birds_stereo.wav","What type of animal are present?",BIRDS
"150209 Trevor Webb Air Cyclinder.wav","how many times is the item started up?",SIX
"mijo + folk och skotrar 1.wav","What sound can be heard at the end?",LAWNMOWER
"mijo + folk och skotrar 1.wav","Which farm animal can be heard?",CAT
"Movements in the Water.wav","How many words are spoken by a person?",ZERO
"mower.wav","What is being mowed?",GRASS
"mower.wav","Where does the ignited engine belong?",LAWNMOWER
"Crisps_open &amp; crunching.wav","What is the person doing?",EATING
"Crisps_open &amp; crunching.wav","What is the person eating?",CHIPS
"Alaska Airlines.wav","Where are the people?",AIRPLANE
"Alaska Airlines.wav","Which industry is the person speaking works in?",AIRPLANE
"car interior, start and depart.wav","what is bumping around?",ENGINE
"car interior, start and depart.wav","What is the object that is undone ?",TAPE
"Kings Cross street sounds.wav","What are the vehicles doing?",MOVING
"Kings Cross street sounds.wav","What is moving in the recording?",TRUCK
"20070406.car.engine.00.wav","How many times did it take to start the engine?",ONE
"20070406.car.engine.00.wav","What is the object that was being turned on?",TRUCK
"greece_naxos_cicadas_3.wav","What is making the chirping?",BIRD
"greece_naxos_cicadas_3.wav","What noise are the insects making?",BUZZING
"cornflake.wav","How many times does the sound repeat?",SEVEN
"Traffic 1 Bikes &amp; cars.wav","What is the dirty air spewed out the back end of these machines called?",EXHAUST
"Traffic 1 Bikes &amp; cars.wav","What kind of animals are here?",BIRDS
"MrM_OldAutoFocus_Nikon2020.wav","What is the object being adjusted likely called?",TAPE
"MrM_OldAutoFocus_Nikon2020.wav","What kind of buzzing noise is the radio making?",STATIC
"Turning Pages.wav","what is being moved?",PAPER
"parkfree.wav","What are the people doing?",PLAYING
"parkfree.wav","Where are all these people getting together?",PLAYGROUND
"RowanMagennis_160019_SD100_PageTurning.wav","how many times is a page turned?",SIX
"RowanMagennis_160019_SD100_PageTurning.wav","What is the person cutting?",PAPER
"0232 Street_birds_2.wav","How many loud bangs are there?",ONE
"Narrowboat - Output - Stereo Out.wav","What is the object doing in the end?",REVVING
"pages turning.wav","What is someone flipping through?",CARDS
"Playing With Tin Foil.wav","How many people are making noise?",TWO
"London Street.wav","How many people are talking?",TWO
"London Street.wav","What sex is the individual who expectorates in the clip?",MALE
"wind&amp;chimes.wav","How is the weather?",WINDY
"Singapore Street Scape.wav","What is the gender of the person talking in the background ?",FEMALE
"evening_rain.wav","What is falling down?",RAIN
"Ambience - Generator.wav","What is the volume of the drilling?",LOUD
"Ambience - Generator.wav","What type of machine does this sound like that starts with a J and ends with an R?",JACKHAMMER
"Unseathing &amp; Wobble.wav","How many different instruments are there?",THREE
"Unseathing &amp; Wobble.wav","How many times does the person click their fingers?",SEVEN
"Train and dog.wav","How many legs do these animals have?",TWO
"Train and dog.wav","How many times does the dog bark?",ONE
"air show flyby 2007-08-18.wav","How many aircrafts are heard taking off ?",ONE
"air show flyby 2007-08-18.wav","What vehicle is making that loud rumbling noise?",AIRPLANE
"Ambient_Winter.wav","How many times a tapping sound can be heard ?",TWO
"passenger train bells.wav","How many loud sources of noise appear?",THREE
"passenger train bells.wav","What vehicle is heard in the background?",TRAIN
"Fergus Whining.wav","How many times does the puppy howl?",FIVE
"Fergus Whining.wav","What animal is this?",DOG
"Rain 04 091012.wav","What's coming out of the sky?",RAIN
"Vestibule in the automotive factory.wav","What is making the rumbling noise?",MACHINE
"Snapping twig.wav","How many items get broken?",FOUR
"Snapping twig.wav","How many times does an object hit other object?",FOUR
"creaking train.wav","How many people are there?",ZERO
"creaking train.wav","What is making the noise?",TRAIN
"High_Stone_walk.wav","What type of ground is the person walking on?",GRASS
"it_has_just_begun.wav","What is exploding?",FIREWORKS
"drain the water.wav","Which fluid is producing this sound?",WATER
"0401 Traffic_light_sound.wav","How many birds are chirping?",ONE
"0401 Traffic_light_sound.wav","What is the bird doing?",CHIRPING
"GulfWaves2.wav","What sort of body of water is this?",OCEAN
"GulfWaves2.wav","Where are the waves washing up to?",SHORE
"AutoViolinTest New Blast.wav","What genre is this sound?",HORROR
"AutoViolinTest New Blast.wav","where is the noise coming from?",TRAIN
"printer.wav","What is the cadence of the sound?",STEADY
"printer.wav","What type of noise is it?",MACHINERY
"fs_brokenMixer302-2.wav","How many high pitch sounds are present?",TWO
"fs_brokenMixer302-2.wav","What is causing the hissing?",MACHINE
"Ominous Ambience.wav","How many patterns does the noise follow?",TWO
"Ominous Ambience.wav","How many UFO's are there?",ONE
"ATM-LES-CIST-1,50.wav","What animal is singing?",BIRD
"Glass jar on board.wav","What is happening to the glass?",TAPPING
"Glass jar on board.wav","What is the non-glass being hit?",WOOD
"Ambience Night crickets.wav","What insect is chirping?",CRICKET
"Ambience Night crickets.wav","what sound are the crickets making?",CHIRPING
"Turning Book Pages.wav","How many pages are turned?",TWELVE
"Turning Book Pages.wav","What activity is taking place?",READING
"chinesealarmclock.wav","What household object useful for keeping track of time makes this sound?",CLOCK
"chinesealarmclock.wav","What is used?",TIMER
"Train Passby Right to Left with Horn Short 02.wav","Where can this sound be heard?",TRACKS
"Hatched.wav","What animal makes the yapping sound?",BIRD
"Hatched.wav","What are the animals doing?",CHIRPING
"PS3F_FOZ_Terminal_motor onibus_sabado_tarde.wav","what does the car do at the end?",DRIVE
"Bells of St Alkelda&#39;s Church, Giggleswick, England.wav","What time is it?",NINE
"plasglass.wav","What is the person doing to the metal?",HITTING
"Shower Running 01.wav","Where is the water coming from?",SHOWER
"Santa Motor.wav","What sort of work are the people doing?",SAWING
"Bag.wav","What is the person doing?",WALKING
"nature-waterfall-Blaafarveverket-090721.wav","What type of noise is it?",WATERFALL
"StepsOnGravel.wav","How many steps does the person take?",EIGHTEEN
"StepsOnGravel.wav","What type of surface are they walking on?",GRAVEL
"Rolling Drawer.wav","What is the material of the drawer?",WOOD
"Metra Train.wav","how many times does the beep happen?",FIFTY
"Metra Train.wav","What direction is the machine going?",AWAY
"PassingCars.wav","What type of vehicle is heard passing by?",CAR
"raindrops_metalcover.wav","What device is turning over and over?",GRINDER
"20090105.frying.03.wav","What is happening with the liquid?",BOILING
"kettle boiling on gas stove.wav","What is being pushed?",CART
"stonemachine.wav","What is the person doing?",WALKING
"RAIN ON CONCRETE.wav","What is making the splashing?",WATER
"walking 2.wav","How many steps does the person take?",FIFTY
"walking 2.wav","What are the shoes crunching down on?",SNOW
"Chime.wav","How many dings are there?",TWO
"Chime.wav","What material is this object that is used to make the echo sound made of ?",METAL
"Crowd Walla_Close Perspective.wav","What is the gender of the people talking?",MALE
"civenna bell.wav","Where is this bell located?",CHURCH
"birds forest.wav","How many times can a birds be heard chirping?",FOUR
"birds forest.wav","What is the distance of the first bird's trilling?",FAR
"Gong bashing repetitively with resonance.wav","How many times is the instrument struck?",ONCE
"Gong bashing repetitively with resonance.wav","What is being struck multiple times?",BELL
"Washing Hands.wav","What is making the constant rushing noise?",WATER
"crowd2.wav","How many people are in the space?",MANY
"crowd2.wav","What are people doing that is causing this noise?",TALKING
"knife-sword sounds.wav","How many different types of metal are being hit together?",TWO
"knife-sword sounds.wav","How many times does the person hit the metal or glass rod?",TWELVE
"water.wav","what does the water do?",FLOWING
"water.wav","What is running?",WATER
"Greater Spotted Woodpecker.wav","What kind of animal can be heard?",BIRD
"CarFerrySeaDogsPeople.wav","What type of animal can be heard?",DOG
"waterpipesandworkers.wav","what does the saw do at the end?",STOP
"waterpipesandworkers.wav","What object is in use?",SAW
"20080928.rain.scooter.wav","How many vehicles are there?",ONE
"20061215.early.morning.wav","What furry animal can be heard making a noise?",DOG
"Concrete Stairs.wav","What sound might this be if made by a shoe?",STAIRS
"Concrete Stairs.wav","What sport is being played?",BASKETBALL
"rain water drops on metal roof.wav","What type of precipitation is this?",RAIN
"WindChin-cut.wav","What kind of musical instrument is played?",XYLOPHONE
"Mechanical camera sound.wav","how many clicking noises are there?",SEVEN
"SwansFlyBy.wav","What kind of animals are there?",GOOSE
"SwansFlyBy.wav","what makes the quack sound?",DUCK
"20070719.plaza.nueva.wav","What animals can be heard?",BIRDS
"20070719.plaza.nueva.wav","What makes three clicking sounds at the end?",SHOES
"Galaktisk time signal.wav","What general art form is this?",MUSIC
"Galaktisk time signal.wav","What instrument is used here?",XYLOPHONE
"Windy_Night_01.wav","What is the water doing?",WAVES
"Kettle Boil.wav","What machine is making this noise?",CAR
"Kettle Boil.wav","What process is being carried out?",DRIVING
"Pedestrian street cph.wav","How many motor vehicles pass by?",ONE
"Pedestrian street cph.wav","How many people are speaking?",TWO
"pill bottle 4.wav","Put are pills being poured into?",BOTTLE
"Walking in the snow.wav","What is chirping?",BIRD
"Walking in the snow.wav","What is the person walking on?",SNOW
"Playground_Near_The_Street.wav","Who can be heard talking in the background?",PEOPLE
"Close Cracking Thunder.wav","How many thunderclaps can be heard?",ONE
"Close Cracking Thunder.wav","What is falling from the sky?",RAIN
"Sundsvall Harbour.wav","What animal is making frequent noise?",BIRD
"_Stream 3 at Krka falls.wav","How is the weather?",RAINY
"_Stream 3 at Krka falls.wav","What is making the loud noise?",RAIN
"old harbour ambiance NL 150920_0781.wav","How many times did a bell chime?",THREE
"Otari Walk.wav","Who's on the background?",KIDS
"train in the field.wav","What element of nature is occurring?",WIND
"080912_00_grinder_wood.wav","What is making the noise?",CHAINSAW
"Paging through book.wav","What is being opened?",BOOK
"Zoo2-20130725.wav","what are the birds doing?",CHIRPING
"Train left to right.wav","What is passing by?",TRAIN
"Train left to right.wav","What kind of vehicle can be heard?",TRAIN
"20141026 Chihuahua Barking Licking 01.wav","How many times is the sound repeated?",TWENTY
"20141026 Chihuahua Barking Licking 01.wav","What is the animal called creating the sound?",DOG
"keurig-coffe-maker.wav","How many different speeds does the motor move at after the sucking sound finishes?",TWO
"Manwe-metal_tools_on_concrete.wav","What is being dropped?",METAL
"Manwe-metal_tools_on_concrete.wav","What is the metal most likely being dropped on?",TABLE
"Industrial Heating Vent.wav","what does the machine seem to be made of?",METAL
"Industrial Heating Vent.wav","When does it get quieter?",NEVER
"Heavy rain - some people 2.wav","How is the weather?",RAINY
"birds at dawn of spring.wav","What animal is present?",BIRD
"birds at dawn of spring.wav","What are the birds doing?",CHIRPING
"Flipping Pages.wav","How many pages are being turned?",SEVEN
"Flipping Pages.wav","What activity is being done with this book?",READING
"rain.thunder.crickets-01.wav","How is the weather?",WINDY
"rain.thunder.crickets-01.wav","What type of insect is making that noise in the background?",CRICKET
"Post vibrating (contact microphone).wav","How many objects are being hit?",ONE
"wind in the trees.wav","What kind weather is it?",RAINY
"wind in the trees.wav","What sound can be heard?",WATER
"2009-07-23_1730_Serralves, Fountain recorded between the fountains.wav","Of the two sounds being heard, which is closer?",WATER
"2009-07-23_1730_Serralves, Fountain recorded between the fountains.wav","What is flying overhead?",AIRPLANE
"Turning on Shower 2_1-2.wav","What weather phenomena is this sound associated with?",RAIN
"20061205.washing.machine.wash.wav","What object is making the mechanical noise?",CUTTER
"20061205.washing.machine.wash.wav","When does the noise stop?",END
"mosquito.wav","how is the air behaving from the balloon?",SQUEAKING
"mosquito.wav","What is the air being released from?",BALLOON
"20100422.waterfall.birds.wav","How many legs do each of these creatures have?",TWO
"20100422.waterfall.birds.wav","What kinds of animals are these?",BIRDS
"Goldfinch and traffic.wav","what are the birds doing?",CHIRPING
"Dawn-with-a-Pheasant.wav","How many feet do these animals have?",TWO
"Dawn-with-a-Pheasant.wav","What is the sound that is made two times at the end called?",CHIRP
"Car up over canal bridge.wav","How many vehicles can be heard speeding by ?",ONE
"Car up over canal bridge.wav","What kind of animal is nearby?",BIRD
"Living Minute - Winter Thaw.wav","If this is occurring in nature, what is the water striking?",ROCK
"foot_steps_snow_02.wav","what is swooshing?",SNOW
"Stove Top(Gas)_1-2.wav","How many times is the object turned on and off?",THREE
"Stove Top(Gas)_1-2.wav","What was turned on?",TAP
"Metal Bearing rolling spinning Start to Stop continuous Slow down creaky 2.wav","On what surface is the rotating item resting on?",TABLE
"Metal Bearing rolling spinning Start to Stop continuous Slow down creaky 2.wav","What is inside the bottle making the noise?",COIN
"writing_with_bold_marker (miroslawski.net).wav","what is put on the market at the end?",TOP
"writing_with_bold_marker (miroslawski.net).wav","What is the person doing?",WRITING
"Pegasus running.wav","What kind of vehicle is mowing the lawn?",LAWNMOWER
"Pegasus running.wav","What part of the car can be heard?",ENGINE
"wawawawawwawawawwaterrings.wav","How many times does the pulse beat?",HUNDRED
"wawawawawwawawawwaterrings.wav","What's the most noticeable component of the rhythm?",PULSING
"Baking Tray Hits.wav","How many times is the object dropped?",TWELVE
"Booklet_-_Leaf_through_01_L_Close_R_Distant.wav","How many pages were turned over ?",EIGHT
"Booklet_-_Leaf_through_01_L_Close_R_Distant.wav","What is the material of what is being turned over?",PAPER
"honeyimhome.wav","What slams shut?",DOOR
"Slow Carillon - GoSoundtrack .wav","How many times is the instrument struck?",TEN
"Slow Carillon - GoSoundtrack .wav","What is the pitch of the notes?",HIGH
"harbour scene 1.wav","Who is talking in the background?",CHILDREN
"Thunder - 1.wav","How many times does the thunder roll?",ONE
"Thunder - 1.wav","What is rumbling in the background?",THUNDER
"Pencil Scratch 2.wav","What is the person doing?",SCRIBBLING
"Pencil Scratch 2.wav","Which body part is typically used to control the tool being utilized?",HAND
"20100401.brussels.01.wav","How many times did the bell ring?",THREE
"20100401.brussels.01.wav","Where are the people?",CHURCH
"shoreline_waves_seagulls.wav","How many birds are making noise?",ONE
"shoreline_waves_seagulls.wav","What animals are there?",SEAGULLS
"Mockingbird singing @ Alfama.wav","What animal is communicating in the recording?",BIRD
"Singing Birds.wav","What do these creatures build, in order to raise their young?",NESTS
"Singing Birds.wav","Where do these animals live?",FOREST
"Baking dish picked up put down.wav","Which thud is the softest?",FIRST
"R09_0005 bird ambience.wav","What animal can be heard communicating?",BIRD
"egg beater.wav","What does the machine do?",DRILL
"egg beater.wav","when does the machine turn off?",NEVER
"Spaceship background ambience.wav","What term would this clip be?",SILENT
"officeWaterPumpShort1.wav","What is making the cracking sound?",ICE
"officeWaterPumpShort1.wav","Where is the liquid going?",CUP
"WaterFall2.wav","how many birds are heard?",NONE
"WaterFall2.wav","How many people are talking?",ZERO
"imm110 assignment 4a.wav","What animal makes noise?",DUCK
"md1trk10.wav","How is this object being moved?",PULLED
"GarbageTruck.wav","What is the utility vehicle doing at the beginning?",MOVING
"GarbageTruck.wav","What kind of vehicle is backing up?",TRUCK
"Crows.wav","How do these animals travel around?",FLYING
"Crows.wav","What type of animal is making noise in the background ?",BIRD
"freezer hum.wav","what is the sound coming from?",FAN
"Grasshoppers_and_wind1.wav","What is hissing?",SNAKE
"Grasshoppers_and_wind1.wav","What is the insect making noise?",CRICKET
"Growling and Barking Dog.wav","How many times does the dog bark?",THIRTEEN
"Growling and Barking Dog.wav","what kind of animal is making the noise?",DOG
"smallgrocery.wav","How many times does the machine beep?",EIGHT
"smallgrocery.wav","What glass objects can be heard to clink near the end of the clip?",BOTTLES
"Footdrags Dirt.wav","Frequently performing this activity can improve what aspect of a person?",UNKNOWN
"Footdrags Dirt.wav","What is the person doing?",WALKING
"stream_small.wav","What liquid flowing sound is this ?",WATER
"stream_small.wav","What would a person carry over their head for protection from this?",UMBRELLA
"cup.wav","What is the object that the person is scraping?",WOOD
"Washing Machine Water Filling Up.wav","How many times is the water muffled or disturbed?",NONE
"Pluja al 4L.wav","What material is being hit by the rain?",METAL
"STE-003_thunder_rain.wav","What is falling from the sky?",RAIN
"kitchensinkturningonandoff.wav","What is happening here?",DRAINING
"Stream 7 at Krka falls.wav","What type of weather might this be?",RAIN
"01-bottle-water-sparkle.wav","What is the container made of?",GLASS
"01-bottle-water-sparkle.wav","what was opened?",SODA
"chicken_freesound.wav","what makes the flapping sound?",CHICKEN
"chicken_freesound.wav","What sound does the chicken make?",CLUCKING
"PassingCars02.wav","How many vehicles passed by ?",FOUR
"PassingCars02.wav","What animal can be heard in the background?",BIRDS
"Whispering Trees.wav","What instrument is played at the end?",GUITAR
"Nord_Odal_Nyhus_04_juni_2011_quiet_forest_birds_insects_leaf_rustle_02.wav","What animal is heard here?",BIRD
"Interior Plane Taking Off.wav","how many times does the animal chirp?",FOUR
"Interior Plane Taking Off.wav","What creature can be heard chirping?",BIRD
"Leeds City Centre-Busses.wav","What kind of machinery can be heard?",ENGINE
"Leeds City Centre-Busses.wav","Which part of the vehicle is producing the noise?",ENGINE
"Ketchup Farts.wav","What does the person spit from their mouth?",WATER
"Ketchup Farts.wav","What is the person doing?",RINSING
"12_Ambient_Quarry_High_44_16.wav","How many questions are asked?",THREE
"birds-vendicari.wav","How many bird species are in this clip?",TWO
"birds-vendicari.wav","What type of bird can be heard in the background?",OWL
"background2(bar or pub).wav","People sometimes emit this sound after hearing a good what?",LAUGH
"Pulley Sounds.wav","How many people can be heard?",ONE
"radio static 3.wav","What is the person doing on the electrical device?",CHANGING
"shower running.wav","How many times does the rain make a loud thump as it hits a surface?",THREE
"Cat Eating Wet Food (Purring at start but not throughout).wav","What is the dog doing to the food with its tongue?",EATING
"Cat Eating Wet Food (Purring at start but not throughout).wav","What tone are the animal's grunts?",DEEP
"20091225.garage.door.wav","What is happening with the liquid?",MIXING
"20091225.garage.door.wav","What type of material is being cut by the machine ?",WOOD
"Snow effects.wav","How many people are walking through snow?",ONE
"Snow effects.wav","What is the person walking through or over?",SNOW
"book handling.wav","What is being flipped?",BOOK
"book handling.wav","What item is being used to make that noise?",PAPER
"a gentle breeze, wind 2.wav","How is the weather?",WINDY
"a gentle breeze, wind 2.wav","how many times can a car be heard?",ONCE
"safe.wav","What is the latch attached to?",GATE
"cacerolada_barcelona.wav","What is the main instrument being used to make sound?",BELL
"Crickets and dogs barking at night in a residential district of Tucson. City and cars in the far background.wav","what are the dogs doing?",BARKING
"Crickets and dogs barking at night in a residential district of Tucson. City and cars in the far background.wav","What type of animal can be heard throughout the clip?",DOG
"160903 Dunrobin Croquet.wav","How many stones are falling?",TWO
"kitchen metal.wav","What group of instruments is being used?",DRUMS
"Crickets indoors.wav","What animal is making the chirping?",CRICKET
"Amb Resid Ext 001.wav","How many vehicles pass by?",ONE
"Amb Resid Ext 001.wav","what is making the loud engine sounds?",TRUCK
"STE-011 broadway bridge traffic.wav","What is making this sound?",CARS
"STE-011 broadway bridge traffic.wav","What part of the vehicle is making that sound?",ENGINE
"Remix #3  of 30938__halleck__crash1-reverse.wav","What film genre could this be featured in?",HORROR
"Remix #3  of 30938__halleck__crash1-reverse.wav","What type of percussion instrument is being played?",CYMBAL
"md1trk1.wav","how many times does the phone ring?",ONE
"md1trk1.wav","What appliance is running throughout the clip?",WASHER
"Copper Tea Kettle, water, boil, whistle_1.wav","What is boiling?",WATER
"Copper Tea Kettle, water, boil, whistle_1.wav","What is on the stove top?",KETTLE
"20070128.turbine.wav","What general thing would make this sort of sound?",MACHINE
"20070128.turbine.wav","Who would work on the tool making this sound?",CONSTRUCTION
"0346 Traffic_at_Sindang.wav","What mode of transportation can be heard?",BUS
"Rain Thunder - Copy.wav","What is making the loud crashing noise in the background?",THUNDER
"Rain Thunder - Copy.wav","What is the name of this event?",THUNDERSTORM
"Village Morning Atmos.wav","how many barks are heard?",THIRTY
"Village Morning Atmos.wav","What are the dogs doing?",BARKING
"kikkers.wav","What is the size of these animals?",SMALL
"DAB RADIO FREAK OUT.wav","What is the noise from?",MACHINE
"progetto_sound_design_prova1.wav","how many people are talking?",THREE
"progetto_sound_design_prova1.wav","What is the gender of the loudest speaker?",MALE
"Traffic Ambient.wav","What gets precedingly louder before fading away?",MOTORCYCLE
"animals-pig-hens-Blaafarveverket-090721.wav","How many animals can be heard distinctly?",TWO
"animals-pig-hens-Blaafarveverket-090721.wav","What part of the day is the noisy bird often heard?",MORNING
"Tui Birdsong New Zealand.wav","What kind of animal is making the high pitch noises?",BIRD
"train at crossing, camden arkansas.wav","What type of transportation is this?",TRAIN
"dish drumroll metal spoons.wav","What is hitting the glass?",UTENSIL
"dish drumroll metal spoons.wav","what is one object doing to the other?",HITTING
"Heavy rain and thunder in Oklahoma.wav","What is the loud sound at the beginning?",THUNDER
"january birds yorkshire.wav","what are the birds doing?",CHIRPING
"january birds yorkshire.wav","What things are making the little sound?",BIRDS
"metal clink.wav","what is the person doing with the items?",MOVING
"metal clink.wav","What is the source of the rattling?",METAL
"SFX_CHEERS-Bottle-CLANK_Beer-n-Wine.wav","how many times is the chime made?",SIX
"SFX_CHEERS-Bottle-CLANK_Beer-n-Wine.wav","What objects are being clinked together?",GLASSES
"Street_Sounds_Night.wav","What vehicle passes by?",CAR
"church-eglise #1.wav","How many people are talking in the background?",TWO
"church-eglise #1.wav","What is that loud roaring sound in the background?",DOOR
"knock on wood.wav","How are they knocking when they knock with the thump?",HARD
"knock on wood.wav","What material are they knocking on?",WOOD
"Splashing Water in Bathtube_1-2.wav","What is the liquid doing?",SPLASHING
"Splashing Water in Bathtube_1-2.wav","What is this person doing with water ?",SPLASHING
"160717 HSN fishing boat passing by.wav","What is the engine noise coming from?",BOAT
"160717 HSN fishing boat passing by.wav","what type of animal can be heard?",BIRD
"Walking at Forest.wav","What human sound is heard in the background?",LAUGHING
"Walking at Forest.wav","What is the woman doing?",WALKING
"061215_chalice_well_cascade_okm2_t02eq.wav","What happens to the volume of water falling?",CONSISTENT
"061215_chalice_well_cascade_okm2_t02eq.wav","what is hitting a surface?",WATER
"nnus_forklift_driveby.wav","What type of vehicle is this ?",TRAIN
"creaking dishwasher_2.wav","How many times is the door open or closed?",THREE
"creaking dishwasher_2.wav","What is making that creaky sounds?",METAL
"Morgens 01.wav","What is chirping loudly?",BIRDS
"Diesel train arrives and departs 2.wav","what is the car doing?",MOVING
"cf_AT_ESCH_SchlafzMittagNorm_WIND.wav","In what kind of building are the bells ringing?",CHURCH
"Walking in Grass Past Cyclist in Evening.wav","What is the person doing?",HIKING
"20071229.cooing.wav","What is the person talking in the background doing?",WALKING
"Shanghai Traffic Near Peoples Square.wav","How loud is it?",VERY
"Strimmers And Chainsaw 1.wav","what is turned on?",BIKE
"Strimmers And Chainsaw 1.wav","What work is being done?",SAWING
"STE-005.wav","what makes the jingling sound?",METAL
"drive by moped.wav","What is producing this noise?",CAR
"October night, cicadas, crickets, jet flyover.wav","What is moving?",AIRPLANE
"YANN SDB SARAH.wav","What is dripping?",WATER
"YANN SDB SARAH.wav","what is the water doing?",RUNNING
"fire_engine_patrolling.wav","how many times does the bell sound?",SEVENTEEN
"Pebbles_Scrape_Drag_Foot.wav","What is the person walking on?",GRAVEL
